02:42:46.783563 enp3s0 Out IP localhost.localdomain.56734 > ip-api.com.http: Flags [S], seq 1255490982, win 32120, options [mss 1460,sackOK,TS val 1400303960 ecr 0,nop,wscale 7], length 0
02:42:46.784898 enp3s0 Out IP localhost.localdomain.56746 > ip-api.com.http: Flags [S], seq 2937155337, win 32120, options [mss 1460,sackOK,TS val 1400303961 ecr 0,nop,wscale 7], length 0
02:42:46.864238 enp3s0 In  IP ip-api.com.http > localhost.localdomain.56746: Flags [S.], seq 1986141268, ack 2937155338, win 8190, options [mss 1460], length 0
02:42:46.864311 enp3s0 Out IP localhost.localdomain.56746 > ip-api.com.http: Flags [.], ack 1, win 32120, length 0
02:42:46.864382 enp3s0 Out IP localhost.localdomain.56746 > ip-api.com.http: Flags [P.], seq 1:161, ack 1, win 32120, length 160: HTTP: GET /json/172.217.25.163 HTTP/1.1
02:42:46.873648 enp3s0 In  IP ip-api.com.http > localhost.localdomain.56734: Flags [S.], seq 2780885961, ack 1255490983, win 8190, options [mss 1460], length 0
02:42:46.873664 enp3s0 Out IP localhost.localdomain.56734 > ip-api.com.http: Flags [.], ack 1, win 32120, length 0
02:42:46.873712 enp3s0 Out IP localhost.localdomain.56734 > ip-api.com.http: Flags [P.], seq 1:161, ack 1, win 32120, length 160: HTTP: GET /json/142.250.76.132 HTTP/1.1
02:42:47.154765 enp3s0 Out IP localhost.localdomain.56746 > ip-api.com.http: Flags [P.], seq 1:161, ack 1, win 32120, length 160: HTTP: GET /json/172.217.25.163 HTTP/1.1
02:42:47.170576 enp3s0 Out IP localhost.localdomain.56734 > ip-api.com.http: Flags [P.], seq 1:161, ack 1, win 32120, length 160: HTTP: GET /json/142.250.76.132 HTTP/1.1
02:42:47.185963 enp3s0 In  IP ip-api.com.http > localhost.localdomain.56746: Flags [P.], seq 1:462, ack 161, win 8190, length 461: HTTP: HTTP/1.1 200 OK
02:42:47.186011 enp3s0 Out IP localhost.localdomain.56746 > ip-api.com.http: Flags [.], ack 462, win 31659, length 0
02:42:47.186548 enp3s0 Out IP localhost.localdomain.45376 > ip-api.com.http: Flags [P.], seq 714557690:714557843, ack 2293811209, win 32120, length 153: HTTP: GET /json/8.8.8.8 HTTP/1.1
02:42:47.186839 enp3s0 Out IP localhost.localdomain.56746 > ip-api.com.http: Flags [F.], seq 161, ack 462, win 31659, length 0
02:42:47.188659 enp3s0 In  IP ip-api.com.http > localhost.localdomain.56734: Flags [P.], seq 1:443, ack 161, win 8190, length 442: HTTP: HTTP/1.1 200 OK
02:42:47.188675 enp3s0 Out IP localhost.localdomain.56734 > ip-api.com.http: Flags [.], ack 443, win 31678, length 0
02:42:47.189711 enp3s0 Out IP localhost.localdomain.56734 > ip-api.com.http: Flags [F.], seq 161, ack 443, win 31678, length 0
02:42:47.234330 enp3s0 In  IP ip-api.com.http > localhost.localdomain.56746: Flags [.], ack 161, win 8190, length 0
02:42:47.260877 enp3s0 In  IP ip-api.com.http > localhost.localdomain.56734: Flags [.], ack 161, win 8190, length 0
02:42:47.265898 enp3s0 In  IP ip-api.com.http > localhost.localdomain.56746: Flags [F.], seq 462, ack 162, win 8190, length 0
02:42:47.265953 enp3s0 Out IP localhost.localdomain.56746 > ip-api.com.http: Flags [.], ack 463, win 31659, length 0
02:42:47.280413 enp3s0 In  IP ip-api.com.http > localhost.localdomain.56734: Flags [F.], seq 443, ack 162, win 8190, length 0
02:42:47.280468 enp3s0 Out IP localhost.localdomain.56734 > ip-api.com.http: Flags [.], ack 444, win 31678, length 0
02:42:47.511426 enp3s0 In  IP ip-api.com.http > localhost.localdomain.45376: Flags [P.], seq 1:455, ack 153, win 8190, length 454: HTTP: HTTP/1.1 200 OK
02:42:47.511477 enp3s0 Out IP localhost.localdomain.45376 > ip-api.com.http: Flags [.], ack 455, win 31666, length 0
02:42:47.512186 enp3s0 Out IP localhost.localdomain.45376 > ip-api.com.http: Flags [F.], seq 153, ack 455, win 31666, length 0
02:42:47.597439 enp3s0 In  IP ip-api.com.http > localhost.localdomain.45376: Flags [F.], seq 455, ack 154, win 8190, length 0
02:42:47.597479 enp3s0 Out IP localhost.localdomain.45376 > ip-api.com.http: Flags [.], ack 456, win 31666, length 0
02:42:48.498131 wlp2s0 In  IP 10.0.0.100.54350 > sin01s16-in-f3.1e100.net.http: Flags [S], seq 1160143543, win 65535, options [mss 1460,sackOK,TS val 1874263142 ecr 0,nop,wscale 10], length 0
02:42:48.498376 enp3s0 Out IP localhost.localdomain.54350 > sin01s16-in-f3.1e100.net.http: Flags [S], seq 1160143543, win 65535, options [mss 1460,sackOK,TS val 1874263142 ecr 0,nop,wscale 10], length 0
02:42:48.529130 enp3s0 In  IP sin01s16-in-f3.1e100.net.http > localhost.localdomain.54350: Flags [S.], seq 2615778418, ack 1160143544, win 65535, options [mss 1412,sackOK,TS val 2433871465 ecr 1874263142,nop,wscale 8], length 0
02:42:48.529403 wlp2s0 Out IP sin01s16-in-f3.1e100.net.http > 10.0.0.100.54350: Flags [S.], seq 2615778418, ack 1160143544, win 65535, options [mss 1412,sackOK,TS val 2433871465 ecr 1874263142,nop,wscale 8], length 0
02:42:48.538177 wlp2s0 In  IP 10.0.0.100.54350 > sin01s16-in-f3.1e100.net.http: Flags [.], ack 1, win 64, options [nop,nop,TS val 1874263182 ecr 2433871465], length 0
02:42:48.538303 enp3s0 Out IP localhost.localdomain.54350 > sin01s16-in-f3.1e100.net.http: Flags [.], ack 1, win 64, options [nop,nop,TS val 1874263182 ecr 2433871465], length 0
02:42:48.539981 wlp2s0 In  IP 10.0.0.100.54350 > sin01s16-in-f3.1e100.net.http: Flags [P.], seq 1:228, ack 1, win 64, options [nop,nop,TS val 1874263183 ecr 2433871465], length 227: HTTP: GET /generate_204 HTTP/1.1
02:42:48.540173 enp3s0 Out IP localhost.localdomain.54350 > sin01s16-in-f3.1e100.net.http: Flags [P.], seq 1:228, ack 1, win 64, options [nop,nop,TS val 1874263183 ecr 2433871465], length 227: HTTP: GET /generate_204 HTTP/1.1
02:42:48.568616 enp3s0 Out IP localhost.localdomain.56760 > ip-api.com.http: Flags [S], seq 756187310, win 32120, options [mss 1460,sackOK,TS val 1400305745 ecr 0,nop,wscale 7], length 0
02:42:48.571315 enp3s0 In  IP sin01s16-in-f3.1e100.net.http > localhost.localdomain.54350: Flags [.], ack 228, win 1050, options [nop,nop,TS val 2433871508 ecr 1874263183], length 0
02:42:48.571386 enp3s0 In  IP sin01s16-in-f3.1e100.net.http > localhost.localdomain.54350: Flags [P.], seq 1:147, ack 228, win 1050, options [nop,nop,TS val 2433871508 ecr 1874263183], length 146: HTTP: HTTP/1.1 204 No Content
02:42:48.571386 enp3s0 In  IP sin01s16-in-f3.1e100.net.http > localhost.localdomain.54350: Flags [F.], seq 147, ack 228, win 1050, options [nop,nop,TS val 2433871508 ecr 1874263183], length 0
02:42:48.571506 wlp2s0 Out IP sin01s16-in-f3.1e100.net.http > 10.0.0.100.54350: Flags [.], ack 228, win 1050, options [nop,nop,TS val 2433871508 ecr 1874263183], length 0
02:42:48.571659 wlp2s0 Out IP sin01s16-in-f3.1e100.net.http > 10.0.0.100.54350: Flags [P.], seq 1:147, ack 228, win 1050, options [nop,nop,TS val 2433871508 ecr 1874263183], length 146: HTTP: HTTP/1.1 204 No Content
02:42:48.571667 wlp2s0 Out IP sin01s16-in-f3.1e100.net.http > 10.0.0.100.54350: Flags [F.], seq 147, ack 228, win 1050, options [nop,nop,TS val 2433871508 ecr 1874263183], length 0
02:42:48.584987 wlp2s0 In  IP 10.0.0.100.54350 > sin01s16-in-f3.1e100.net.http: Flags [.], ack 147, win 66, options [nop,nop,TS val 1874263230 ecr 2433871508], length 0
02:42:48.585096 enp3s0 Out IP localhost.localdomain.54350 > sin01s16-in-f3.1e100.net.http: Flags [.], ack 147, win 66, options [nop,nop,TS val 1874263230 ecr 2433871508], length 0
02:42:48.586735 wlp2s0 In  IP 10.0.0.100.54350 > sin01s16-in-f3.1e100.net.http: Flags [F.], seq 228, ack 148, win 66, options [nop,nop,TS val 1874263230 ecr 2433871508], length 0
02:42:48.586799 enp3s0 Out IP localhost.localdomain.54350 > sin01s16-in-f3.1e100.net.http: Flags [F.], seq 228, ack 148, win 66, options [nop,nop,TS val 1874263230 ecr 2433871508], length 0
02:42:48.606058 enp3s0 Out IP localhost.localdomain.56762 > ip-api.com.http: Flags [S], seq 3601480308, win 32120, options [mss 1460,sackOK,TS val 1400305782 ecr 0,nop,wscale 7], length 0
02:42:48.617761 enp3s0 In  IP sin01s16-in-f3.1e100.net.http > localhost.localdomain.54350: Flags [.], ack 229, win 1050, options [nop,nop,TS val 2433871554 ecr 1874263230], length 0
02:42:48.617853 wlp2s0 Out IP sin01s16-in-f3.1e100.net.http > 10.0.0.100.54350: Flags [.], ack 229, win 1050, options [nop,nop,TS val 2433871554 ecr 1874263230], length 0
02:42:48.639464 wlp2s0 In  IP 10.0.0.100.46734 > kix07s06-in-f4.1e100.net.http: Flags [S], seq 1122298279, win 65535, options [mss 1460,sackOK,TS val 3275489517 ecr 0,nop,wscale 10], length 0
02:42:48.639669 enp3s0 Out IP localhost.localdomain.46734 > kix07s06-in-f4.1e100.net.http: Flags [S], seq 1122298279, win 65535, options [mss 1460,sackOK,TS val 3275489517 ecr 0,nop,wscale 10], length 0
02:42:48.644932 enp3s0 Out IP localhost.localdomain.56778 > ip-api.com.http: Flags [S], seq 2383050114, win 32120, options [mss 1460,sackOK,TS val 1400305821 ecr 0,nop,wscale 7], length 0
02:42:48.647996 enp3s0 In  IP ip-api.com.http > localhost.localdomain.56760: Flags [S.], seq 3677925441, ack 756187311, win 8190, options [mss 1460], length 0
02:42:48.648012 enp3s0 Out IP localhost.localdomain.56760 > ip-api.com.http: Flags [.], ack 1, win 32120, length 0
02:42:48.648101 enp3s0 Out IP localhost.localdomain.56760 > ip-api.com.http: Flags [P.], seq 1:161, ack 1, win 32120, length 160: HTTP: GET /json/172.217.25.163 HTTP/1.1
02:42:48.648390 enp3s0 Out IP localhost.localdomain.56790 > ip-api.com.http: Flags [S], seq 4294958052, win 32120, options [mss 1460,sackOK,TS val 1400305824 ecr 0,nop,wscale 7], length 0
02:42:48.671092 enp3s0 In  IP kix07s06-in-f4.1e100.net.http > localhost.localdomain.46734: Flags [S.], seq 263601539, ack 1122298280, win 65535, options [mss 1412,sackOK,TS val 2735062629 ecr 3275489517,nop,wscale 8], length 0
02:42:48.671311 wlp2s0 Out IP kix07s06-in-f4.1e100.net.http > 10.0.0.100.46734: Flags [S.], seq 263601539, ack 1122298280, win 65535, options [mss 1412,sackOK,TS val 2735062629 ecr 3275489517,nop,wscale 8], length 0
02:42:48.679564 wlp2s0 In  IP 10.0.0.100.46734 > kix07s06-in-f4.1e100.net.http: Flags [.], ack 1, win 64, options [nop,nop,TS val 3275489555 ecr 2735062629], length 0
02:42:48.679717 enp3s0 Out IP localhost.localdomain.46734 > kix07s06-in-f4.1e100.net.http: Flags [.], ack 1, win 64, options [nop,nop,TS val 3275489555 ecr 2735062629], length 0
02:42:48.680462 wlp2s0 In  IP 10.0.0.100.46734 > kix07s06-in-f4.1e100.net.http: Flags [P.], seq 1:208, ack 1, win 64, options [nop,nop,TS val 3275489555 ecr 2735062629], length 207: HTTP: GET /gen_204 HTTP/1.1
02:42:48.680647 enp3s0 Out IP localhost.localdomain.46734 > kix07s06-in-f4.1e100.net.http: Flags [P.], seq 1:208, ack 1, win 64, options [nop,nop,TS val 3275489555 ecr 2735062629], length 207: HTTP: GET /gen_204 HTTP/1.1
02:42:48.695281 enp3s0 In  IP ip-api.com.http > localhost.localdomain.56762: Flags [S.], seq 4084411842, ack 3601480309, win 8190, options [mss 1460], length 0
02:42:48.695304 enp3s0 Out IP localhost.localdomain.56762 > ip-api.com.http: Flags [.], ack 1, win 32120, length 0
02:42:48.695391 enp3s0 Out IP localhost.localdomain.56762 > ip-api.com.http: Flags [P.], seq 1:161, ack 1, win 32120, length 160: HTTP: GET /json/172.217.25.163 HTTP/1.1
02:42:48.711270 enp3s0 In  IP kix07s06-in-f4.1e100.net.http > localhost.localdomain.46734: Flags [.], ack 208, win 1050, options [nop,nop,TS val 2735062669 ecr 3275489555], length 0
02:42:48.711371 wlp2s0 Out IP kix07s06-in-f4.1e100.net.http > 10.0.0.100.46734: Flags [.], ack 208, win 1050, options [nop,nop,TS val 2735062669 ecr 3275489555], length 0
02:42:48.715659 enp3s0 Out IP localhost.localdomain.56796 > ip-api.com.http: Flags [S], seq 388912769, win 32120, options [mss 1460,sackOK,TS val 1400305892 ecr 0,nop,wscale 7], length 0
02:42:48.736148 enp3s0 In  IP ip-api.com.http > localhost.localdomain.56790: Flags [S.], seq 245120359, ack 4294958053, win 8190, options [mss 1460], length 0
02:42:48.736221 enp3s0 Out IP localhost.localdomain.56790 > ip-api.com.http: Flags [.], ack 1, win 32120, length 0
02:42:48.736307 enp3s0 Out IP localhost.localdomain.56790 > ip-api.com.http: Flags [P.], seq 1:161, ack 1, win 32120, length 160: HTTP: GET /json/172.217.25.163 HTTP/1.1
02:42:48.740280 enp3s0 In  IP ip-api.com.http > localhost.localdomain.56778: Flags [S.], seq 2512301456, ack 2383050115, win 8190, options [mss 1460], length 0
02:42:48.740317 enp3s0 Out IP localhost.localdomain.56778 > ip-api.com.http: Flags [.], ack 1, win 32120, length 0
02:42:48.740370 enp3s0 Out IP localhost.localdomain.56778 > ip-api.com.http: Flags [P.], seq 1:161, ack 1, win 32120, length 160: HTTP: GET /json/172.217.25.163 HTTP/1.1
02:42:48.750855 enp3s0 In  IP kix07s06-in-f4.1e100.net.http > localhost.localdomain.46734: Flags [P.], seq 1:467, ack 208, win 1050, options [nop,nop,TS val 2735062709 ecr 3275489555], length 466: HTTP: HTTP/1.1 204 No Content
02:42:48.750971 enp3s0 In  IP kix07s06-in-f4.1e100.net.http > localhost.localdomain.46734: Flags [F.], seq 467, ack 208, win 1050, options [nop,nop,TS val 2735062709 ecr 3275489555], length 0
02:42:48.751022 enp3s0 Out IP localhost.localdomain.56802 > ip-api.com.http: Flags [S], seq 1861150961, win 32120, options [mss 1460,sackOK,TS val 1400305927 ecr 0,nop,wscale 7], length 0
02:42:48.751132 wlp2s0 Out IP kix07s06-in-f4.1e100.net.http > 10.0.0.100.46734: Flags [P.], seq 1:467, ack 208, win 1050, options [nop,nop,TS val 2735062709 ecr 3275489555], length 466: HTTP: HTTP/1.1 204 No Content
02:42:48.751146 wlp2s0 Out IP kix07s06-in-f4.1e100.net.http > 10.0.0.100.46734: Flags [F.], seq 467, ack 208, win 1050, options [nop,nop,TS val 2735062709 ecr 3275489555], length 0
02:42:48.773380 enp3s0 Out IP localhost.localdomain.56808 > ip-api.com.http: Flags [S], seq 291614083, win 32120, options [mss 1460,sackOK,TS val 1400305949 ecr 0,nop,wscale 7], length 0
02:42:48.801850 enp3s0 In  IP ip-api.com.http > localhost.localdomain.56796: Flags [S.], seq 751459981, ack 388912770, win 8190, options [mss 1460], length 0
02:42:48.801902 enp3s0 Out IP localhost.localdomain.56796 > ip-api.com.http: Flags [.], ack 1, win 32120, length 0
02:42:48.801971 enp3s0 Out IP localhost.localdomain.56796 > ip-api.com.http: Flags [P.], seq 1:161, ack 1, win 32120, length 160: HTTP: GET /json/142.250.76.132 HTTP/1.1
02:42:48.823475 enp3s0 Out IP localhost.localdomain.56810 > ip-api.com.http: Flags [S], seq 3447526341, win 32120, options [mss 1460,sackOK,TS val 1400305999 ecr 0,nop,wscale 7], length 0
02:42:48.824029 enp3s0 Out IP localhost.localdomain.56812 > ip-api.com.http: Flags [S], seq 3539325557, win 32120, options [mss 1460,sackOK,TS val 1400306000 ecr 0,nop,wscale 7], length 0
02:42:48.825484 wlp2s0 In  IP 10.0.0.100.46734 > kix07s06-in-f4.1e100.net.http: Flags [.], ack 467, win 66, options [nop,nop,TS val 3275489703 ecr 2735062709], length 0
02:42:48.825631 enp3s0 Out IP localhost.localdomain.46734 > kix07s06-in-f4.1e100.net.http: Flags [.], ack 467, win 66, options [nop,nop,TS val 3275489703 ecr 2735062709], length 0
02:42:48.826165 wlp2s0 In  IP 10.0.0.100.46734 > kix07s06-in-f4.1e100.net.http: Flags [F.], seq 208, ack 468, win 66, options [nop,nop,TS val 3275489703 ecr 2735062709], length 0
02:42:48.826268 enp3s0 Out IP localhost.localdomain.46734 > kix07s06-in-f4.1e100.net.http: Flags [F.], seq 208, ack 468, win 66, options [nop,nop,TS val 3275489703 ecr 2735062709], length 0
02:42:48.837908 enp3s0 In  IP kix07s06-in-f4.1e100.net.http > localhost.localdomain.46734: Flags [F.], seq 467, ack 208, win 1050, options [nop,nop,TS val 2735062796 ecr 3275489555], length 0
02:42:48.838045 wlp2s0 Out IP kix07s06-in-f4.1e100.net.http > 10.0.0.100.46734: Flags [F.], seq 467, ack 208, win 1050, options [nop,nop,TS val 2735062796 ecr 3275489555], length 0
02:42:48.840062 enp3s0 In  IP ip-api.com.http > localhost.localdomain.56802: Flags [S.], seq 3710634816, ack 1861150962, win 8190, options [mss 1460], length 0
02:42:48.840083 enp3s0 Out IP localhost.localdomain.56802 > ip-api.com.http: Flags [.], ack 1, win 32120, length 0
02:42:48.840148 enp3s0 Out IP localhost.localdomain.56802 > ip-api.com.http: Flags [P.], seq 1:161, ack 1, win 32120, length 160: HTTP: GET /json/142.250.76.132 HTTP/1.1
02:42:48.844884 wlp2s0 In  IP 10.0.0.100.46734 > kix07s06-in-f4.1e100.net.http: Flags [.], ack 468, win 66, options [nop,nop,TS val 3275489723 ecr 2735062796,nop,nop,sack 1 {467:468}], length 0
02:42:48.844993 enp3s0 Out IP localhost.localdomain.46734 > kix07s06-in-f4.1e100.net.http: Flags [.], ack 468, win 66, options [nop,nop,TS val 3275489723 ecr 2735062796,nop,nop,sack 1 {467:468}], length 0
02:42:48.857018 enp3s0 In  IP kix07s06-in-f4.1e100.net.http > localhost.localdomain.46734: Flags [.], ack 209, win 1050, options [nop,nop,TS val 2735062815 ecr 3275489703], length 0
02:42:48.857185 wlp2s0 Out IP kix07s06-in-f4.1e100.net.http > 10.0.0.100.46734: Flags [.], ack 209, win 1050, options [nop,nop,TS val 2735062815 ecr 3275489703], length 0
02:42:48.868321 enp3s0 In  IP ip-api.com.http > localhost.localdomain.56808: Flags [S.], seq 4284702909, ack 291614084, win 8190, options [mss 1460], length 0
02:42:48.868335 enp3s0 Out IP localhost.localdomain.56808 > ip-api.com.http: Flags [.], ack 1, win 32120, length 0
02:42:48.868412 enp3s0 Out IP localhost.localdomain.56808 > ip-api.com.http: Flags [P.], seq 1:161, ack 1, win 32120, length 160: HTTP: GET /json/216.239.34.223 HTTP/1.1
02:42:48.905288 enp3s0 In  IP ip-api.com.http > localhost.localdomain.56810: Flags [S.], seq 3610048930, ack 3447526342, win 8190, options [mss 1460], length 0
02:42:48.905305 enp3s0 Out IP localhost.localdomain.56810 > ip-api.com.http: Flags [.], ack 1, win 32120, length 0
02:42:48.905351 enp3s0 Out IP localhost.localdomain.56810 > ip-api.com.http: Flags [P.], seq 1:161, ack 1, win 32120, length 160: HTTP: GET /json/142.250.76.132 HTTP/1.1
02:42:48.911657 enp3s0 In  IP ip-api.com.http > localhost.localdomain.56812: Flags [S.], seq 3948842215, ack 3539325558, win 8190, options [mss 1460], length 0
02:42:48.911676 enp3s0 Out IP localhost.localdomain.56812 > ip-api.com.http: Flags [.], ack 1, win 32120, length 0
02:42:48.911704 enp3s0 Out IP localhost.localdomain.56812 > ip-api.com.http: Flags [P.], seq 1:161, ack 1, win 32120, length 160: HTTP: GET /json/142.250.76.132 HTTP/1.1
02:42:48.938600 enp3s0 Out IP localhost.localdomain.56760 > ip-api.com.http: Flags [P.], seq 1:161, ack 1, win 32120, length 160: HTTP: GET /json/172.217.25.163 HTTP/1.1
02:42:48.959180 enp3s0 In  IP ip-api.com.http > localhost.localdomain.56760: Flags [P.], seq 1:462, ack 161, win 8190, length 461: HTTP: HTTP/1.1 200 OK
02:42:48.959186 enp3s0 Out IP localhost.localdomain.56760 > ip-api.com.http: Flags [.], ack 462, win 31659, length 0
02:42:48.960009 enp3s0 Out IP localhost.localdomain.56760 > ip-api.com.http: Flags [F.], seq 161, ack 462, win 31659, length 0
02:42:48.986760 enp3s0 Out IP localhost.localdomain.56762 > ip-api.com.http: Flags [P.], seq 1:161, ack 1, win 32120, length 160: HTTP: GET /json/172.217.25.163 HTTP/1.1
02:42:48.992105 enp3s0 In  IP ip-api.com.http > localhost.localdomain.56762: Flags [P.], seq 1:462, ack 161, win 8190, length 461: HTTP: HTTP/1.1 200 OK
02:42:48.992130 enp3s0 Out IP localhost.localdomain.56762 > ip-api.com.http: Flags [.], ack 462, win 31659, length 0
02:42:48.992774 enp3s0 Out IP localhost.localdomain.56762 > ip-api.com.http: Flags [F.], seq 161, ack 462, win 31659, length 0
02:42:49.018471 enp3s0 In  IP ip-api.com.http > localhost.localdomain.56760: Flags [.], ack 161, win 8190, length 0
02:42:49.021161 enp3s0 In  IP ip-api.com.http > localhost.localdomain.56790: Flags [P.], seq 1:462, ack 161, win 8190, length 461: HTTP: HTTP/1.1 200 OK
02:42:49.021200 enp3s0 Out IP localhost.localdomain.56790 > ip-api.com.http: Flags [.], ack 462, win 31659, length 0
02:42:49.021847 enp3s0 Out IP localhost.localdomain.56790 > ip-api.com.http: Flags [F.], seq 161, ack 462, win 31659, length 0
02:42:49.039190 enp3s0 In  IP ip-api.com.http > localhost.localdomain.56760: Flags [F.], seq 462, ack 162, win 8190, length 0
02:42:49.039240 enp3s0 Out IP localhost.localdomain.56760 > ip-api.com.http: Flags [.], ack 463, win 31659, length 0
02:42:49.042611 enp3s0 Out IP localhost.localdomain.56778 > ip-api.com.http: Flags [P.], seq 1:161, ack 1, win 32120, length 160: HTTP: GET /json/172.217.25.163 HTTP/1.1
02:42:49.075501 enp3s0 In  IP ip-api.com.http > localhost.localdomain.56762: Flags [.], ack 161, win 8190, length 0
02:42:49.081055 enp3s0 In  IP ip-api.com.http > localhost.localdomain.56762: Flags [F.], seq 462, ack 162, win 8190, length 0
02:42:49.081106 enp3s0 Out IP localhost.localdomain.56762 > ip-api.com.http: Flags [.], ack 463, win 31659, length 0
02:42:49.098619 enp3s0 Out IP localhost.localdomain.56796 > ip-api.com.http: Flags [P.], seq 1:161, ack 1, win 32120, length 160: HTTP: GET /json/142.250.76.132 HTTP/1.1
02:42:49.109420 enp3s0 In  IP ip-api.com.http > localhost.localdomain.56790: Flags [F.], seq 462, ack 162, win 8190, length 0
02:42:49.109480 enp3s0 Out IP localhost.localdomain.56790 > ip-api.com.http: Flags [.], ack 463, win 31659, length 0
02:42:49.130657 enp3s0 Out IP localhost.localdomain.56802 > ip-api.com.http: Flags [P.], seq 1:161, ack 1, win 32120, length 160: HTTP: GET /json/142.250.76.132 HTTP/1.1
02:42:49.170683 enp3s0 Out IP localhost.localdomain.56808 > ip-api.com.http: Flags [P.], seq 1:161, ack 1, win 32120, length 160: HTTP: GET /json/216.239.34.223 HTTP/1.1
02:42:49.194583 enp3s0 Out IP localhost.localdomain.56810 > ip-api.com.http: Flags [P.], seq 1:161, ack 1, win 32120, length 160: HTTP: GET /json/142.250.76.132 HTTP/1.1
02:42:49.202663 enp3s0 Out IP localhost.localdomain.56812 > ip-api.com.http: Flags [P.], seq 1:161, ack 1, win 32120, length 160: HTTP: GET /json/142.250.76.132 HTTP/1.1
02:42:49.682588 enp3s0 Out IP localhost.localdomain.56796 > ip-api.com.http: Flags [P.], seq 1:161, ack 1, win 32120, length 160: HTTP: GET /json/142.250.76.132 HTTP/1.1
02:42:49.682611 enp3s0 Out IP localhost.localdomain.56778 > ip-api.com.http: Flags [P.], seq 1:161, ack 1, win 32120, length 160: HTTP: GET /json/172.217.25.163 HTTP/1.1
02:42:49.746597 enp3s0 Out IP localhost.localdomain.56802 > ip-api.com.http: Flags [P.], seq 1:161, ack 1, win 32120, length 160: HTTP: GET /json/142.250.76.132 HTTP/1.1
02:42:49.810593 enp3s0 Out IP localhost.localdomain.56812 > ip-api.com.http: Flags [P.], seq 1:161, ack 1, win 32120, length 160: HTTP: GET /json/142.250.76.132 HTTP/1.1
02:42:49.810607 enp3s0 Out IP localhost.localdomain.56810 > ip-api.com.http: Flags [P.], seq 1:161, ack 1, win 32120, length 160: HTTP: GET /json/142.250.76.132 HTTP/1.1
02:42:49.810611 enp3s0 Out IP localhost.localdomain.56808 > ip-api.com.http: Flags [P.], seq 1:161, ack 1, win 32120, length 160: HTTP: GET /json/216.239.34.223 HTTP/1.1
02:42:49.855436 wlp2s0 In  IP 10.0.0.100.54362 > sin01s16-in-f3.1e100.net.http: Flags [S], seq 3467623073, win 65535, options [mss 1460,sackOK,TS val 1874264494 ecr 0,nop,wscale 10], length 0
02:42:49.855719 enp3s0 Out IP localhost.localdomain.54362 > sin01s16-in-f3.1e100.net.http: Flags [S], seq 3467623073, win 65535, options [mss 1460,sackOK,TS val 1874264494 ecr 0,nop,wscale 10], length 0
02:42:49.881869 enp3s0 In  IP sin01s16-in-f3.1e100.net.http > localhost.localdomain.54362: Flags [S.], seq 2059798556, ack 3467623074, win 65535, options [mss 1412,sackOK,TS val 1014327402 ecr 1874264494,nop,wscale 8], length 0
02:42:49.882104 wlp2s0 Out IP sin01s16-in-f3.1e100.net.http > 10.0.0.100.54362: Flags [S.], seq 2059798556, ack 3467623074, win 65535, options [mss 1412,sackOK,TS val 1014327402 ecr 1874264494,nop,wscale 8], length 0
02:42:49.888695 wlp2s0 In  IP 10.0.0.100.54362 > sin01s16-in-f3.1e100.net.http: Flags [.], ack 1, win 64, options [nop,nop,TS val 1874264534 ecr 1014327402], length 0
02:42:49.888799 enp3s0 Out IP localhost.localdomain.54362 > sin01s16-in-f3.1e100.net.http: Flags [.], ack 1, win 64, options [nop,nop,TS val 1874264534 ecr 1014327402], length 0
02:42:49.899231 wlp2s0 In  IP 10.0.0.100.54362 > sin01s16-in-f3.1e100.net.http: Flags [P.], seq 1:228, ack 1, win 64, options [nop,nop,TS val 1874264534 ecr 1014327402], length 227: HTTP: GET /generate_204 HTTP/1.1
02:42:49.899415 enp3s0 Out IP localhost.localdomain.54362 > sin01s16-in-f3.1e100.net.http: Flags [P.], seq 1:228, ack 1, win 64, options [nop,nop,TS val 1874264534 ecr 1014327402], length 227: HTTP: GET /generate_204 HTTP/1.1
02:42:49.925031 enp3s0 In  IP sin01s16-in-f3.1e100.net.http > localhost.localdomain.54362: Flags [.], ack 228, win 1050, options [nop,nop,TS val 1014327445 ecr 1874264534], length 0
02:42:49.925179 wlp2s0 Out IP sin01s16-in-f3.1e100.net.http > 10.0.0.100.54362: Flags [.], ack 228, win 1050, options [nop,nop,TS val 1014327445 ecr 1874264534], length 0
02:42:49.925775 enp3s0 In  IP sin01s16-in-f3.1e100.net.http > localhost.localdomain.54362: Flags [P.], seq 1:147, ack 228, win 1050, options [nop,nop,TS val 1014327446 ecr 1874264534], length 146: HTTP: HTTP/1.1 204 No Content
02:42:49.925807 enp3s0 In  IP sin01s16-in-f3.1e100.net.http > localhost.localdomain.54362: Flags [F.], seq 147, ack 228, win 1050, options [nop,nop,TS val 1014327446 ecr 1874264534], length 0
02:42:49.925959 wlp2s0 Out IP sin01s16-in-f3.1e100.net.http > 10.0.0.100.54362: Flags [P.], seq 1:147, ack 228, win 1050, options [nop,nop,TS val 1014327446 ecr 1874264534], length 146: HTTP: HTTP/1.1 204 No Content
02:42:49.925969 wlp2s0 Out IP sin01s16-in-f3.1e100.net.http > 10.0.0.100.54362: Flags [F.], seq 147, ack 228, win 1050, options [nop,nop,TS val 1014327446 ecr 1874264534], length 0
02:42:49.931034 wlp2s0 In  IP 10.0.0.100.54362 > sin01s16-in-f3.1e100.net.http: Flags [.], ack 147, win 66, options [nop,nop,TS val 1874264574 ecr 1014327446], length 0
02:42:49.931149 enp3s0 Out IP localhost.localdomain.54362 > sin01s16-in-f3.1e100.net.http: Flags [.], ack 147, win 66, options [nop,nop,TS val 1874264574 ecr 1014327446], length 0
02:42:49.931540 wlp2s0 In  IP 10.0.0.100.54362 > sin01s16-in-f3.1e100.net.http: Flags [F.], seq 228, ack 148, win 66, options [nop,nop,TS val 1874264576 ecr 1014327446], length 0
02:42:49.931610 enp3s0 Out IP localhost.localdomain.54362 > sin01s16-in-f3.1e100.net.http: Flags [F.], seq 228, ack 148, win 66, options [nop,nop,TS val 1874264576 ecr 1014327446], length 0
02:42:49.932824 enp3s0 Out IP localhost.localdomain.56816 > ip-api.com.http: Flags [S], seq 2721987647, win 32120, options [mss 1460,sackOK,TS val 1400307109 ecr 0,nop,wscale 7], length 0
02:42:49.954527 enp3s0 Out IP localhost.localdomain.56832 > ip-api.com.http: Flags [S], seq 1708584633, win 32120, options [mss 1460,sackOK,TS val 1400307130 ecr 0,nop,wscale 7], length 0
02:42:49.957082 enp3s0 In  IP sin01s16-in-f3.1e100.net.http > localhost.localdomain.54362: Flags [.], ack 229, win 1050, options [nop,nop,TS val 1014327477 ecr 1874264576], length 0
02:42:49.957249 wlp2s0 Out IP sin01s16-in-f3.1e100.net.http > 10.0.0.100.54362: Flags [.], ack 229, win 1050, options [nop,nop,TS val 1014327477 ecr 1874264576], length 0
02:42:50.001786 enp3s0 Out IP localhost.localdomain.56836 > ip-api.com.http: Flags [S], seq 1764952814, win 32120, options [mss 1460,sackOK,TS val 1400307178 ecr 0,nop,wscale 7], length 0
02:42:50.002762 enp3s0 Out IP localhost.localdomain.56848 > ip-api.com.http: Flags [S], seq 1316733518, win 32120, options [mss 1460,sackOK,TS val 1400307179 ecr 0,nop,wscale 7], length 0
02:42:50.008334 wlp2s0 In  IP 10.0.0.100.46496 > 216.239.34.223.http: Flags [S], seq 3479011092, win 65535, options [mss 1460,sackOK,TS val 1433045844 ecr 0,nop,wscale 10], length 0
02:42:50.008550 enp3s0 Out IP localhost.localdomain.46496 > 216.239.34.223.http: Flags [S], seq 3479011092, win 65535, options [mss 1460,sackOK,TS val 1433045844 ecr 0,nop,wscale 10], length 0
02:42:50.022647 enp3s0 In  IP ip-api.com.http > localhost.localdomain.56816: Flags [S.], seq 1885494332, ack 2721987648, win 8190, options [mss 1460], length 0
02:42:50.022663 enp3s0 Out IP localhost.localdomain.56816 > ip-api.com.http: Flags [.], ack 1, win 32120, length 0
02:42:50.022744 enp3s0 Out IP localhost.localdomain.56816 > ip-api.com.http: Flags [P.], seq 1:161, ack 1, win 32120, length 160: HTTP: GET /json/172.217.25.163 HTTP/1.1
02:42:50.037958 enp3s0 In  IP 216.239.34.223.http > localhost.localdomain.46496: Flags [S.], seq 4024012339, ack 3479011093, win 65535, options [mss 1412,sackOK,TS val 1822188894 ecr 1433045844,nop,wscale 8], length 0
02:42:50.038199 wlp2s0 Out IP 216.239.34.223.http > 10.0.0.100.46496: Flags [S.], seq 4024012339, ack 3479011093, win 65535, options [mss 1412,sackOK,TS val 1822188894 ecr 1433045844,nop,wscale 8], length 0
02:42:50.041153 wlp2s0 In  IP 10.0.0.100.46496 > 216.239.34.223.http: Flags [.], ack 1, win 64, options [nop,nop,TS val 1433045877 ecr 1822188894], length 0
02:42:50.041383 enp3s0 Out IP localhost.localdomain.46496 > 216.239.34.223.http: Flags [.], ack 1, win 64, options [nop,nop,TS val 1433045877 ecr 1822188894], length 0
02:42:50.042802 wlp2s0 In  IP 10.0.0.100.46496 > 216.239.34.223.http: Flags [P.], seq 1:218, ack 1, win 64, options [nop,nop,TS val 1433045878 ecr 1822188894], length 217: HTTP: GET /generate_204 HTTP/1.1
02:42:50.043032 enp3s0 Out IP localhost.localdomain.46496 > 216.239.34.223.http: Flags [P.], seq 1:218, ack 1, win 64, options [nop,nop,TS val 1433045878 ecr 1822188894], length 217: HTTP: GET /generate_204 HTTP/1.1
02:42:50.044435 enp3s0 In  IP ip-api.com.http > localhost.localdomain.56832: Flags [S.], seq 3665754346, ack 1708584634, win 8190, options [mss 1460], length 0
02:42:50.044470 enp3s0 Out IP localhost.localdomain.56832 > ip-api.com.http: Flags [.], ack 1, win 32120, length 0
02:42:50.044547 enp3s0 Out IP localhost.localdomain.56832 > ip-api.com.http: Flags [P.], seq 1:161, ack 1, win 32120, length 160: HTTP: GET /json/172.217.25.163 HTTP/1.1
02:42:50.071902 enp3s0 In  IP 216.239.34.223.http > localhost.localdomain.46496: Flags [.], ack 218, win 1050, options [nop,nop,TS val 1822188928 ecr 1433045878], length 0
02:42:50.072027 wlp2s0 Out IP 216.239.34.223.http > 10.0.0.100.46496: Flags [.], ack 218, win 1050, options [nop,nop,TS val 1822188928 ecr 1433045878], length 0
02:42:50.072034 enp3s0 In  IP 216.239.34.223.http > localhost.localdomain.46496: Flags [P.], seq 1:147, ack 218, win 1050, options [nop,nop,TS val 1822188928 ecr 1433045878], length 146: HTTP: HTTP/1.1 204 No Content
02:42:50.072062 enp3s0 In  IP 216.239.34.223.http > localhost.localdomain.46496: Flags [F.], seq 147, ack 218, win 1050, options [nop,nop,TS val 1822188928 ecr 1433045878], length 0
02:42:50.072210 wlp2s0 Out IP 216.239.34.223.http > 10.0.0.100.46496: Flags [P.], seq 1:147, ack 218, win 1050, options [nop,nop,TS val 1822188928 ecr 1433045878], length 146: HTTP: HTTP/1.1 204 No Content
02:42:50.072219 wlp2s0 Out IP 216.239.34.223.http > 10.0.0.100.46496: Flags [F.], seq 147, ack 218, win 1050, options [nop,nop,TS val 1822188928 ecr 1433045878], length 0
02:42:50.077682 wlp2s0 In  IP 10.0.0.100.46496 > 216.239.34.223.http: Flags [.], ack 147, win 66, options [nop,nop,TS val 1433045912 ecr 1822188928], length 0
02:42:50.077798 enp3s0 Out IP localhost.localdomain.46496 > 216.239.34.223.http: Flags [.], ack 147, win 66, options [nop,nop,TS val 1433045912 ecr 1822188928], length 0
02:42:50.078177 wlp2s0 In  IP 10.0.0.100.46496 > 216.239.34.223.http: Flags [F.], seq 218, ack 148, win 66, options [nop,nop,TS val 1433045913 ecr 1822188928], length 0
02:42:50.078249 enp3s0 Out IP localhost.localdomain.46496 > 216.239.34.223.http: Flags [F.], seq 218, ack 148, win 66, options [nop,nop,TS val 1433045913 ecr 1822188928], length 0
02:42:50.078830 enp3s0 Out IP localhost.localdomain.56864 > ip-api.com.http: Flags [S], seq 1284972791, win 32120, options [mss 1460,sackOK,TS val 1400307255 ecr 0,nop,wscale 7], length 0
02:42:50.090881 enp3s0 In  IP ip-api.com.http > localhost.localdomain.56848: Flags [S.], seq 1601810678, ack 1316733519, win 8190, options [mss 1460], length 0
02:42:50.090909 enp3s0 Out IP localhost.localdomain.56848 > ip-api.com.http: Flags [.], ack 1, win 32120, length 0
02:42:50.090968 enp3s0 Out IP localhost.localdomain.56848 > ip-api.com.http: Flags [P.], seq 1:161, ack 1, win 32120, length 160: HTTP: GET /json/172.217.25.163 HTTP/1.1
02:42:50.091841 enp3s0 In  IP ip-api.com.http > localhost.localdomain.56836: Flags [S.], seq 3461517073, ack 1764952815, win 8190, options [mss 1460], length 0
02:42:50.091852 enp3s0 Out IP localhost.localdomain.56836 > ip-api.com.http: Flags [.], ack 1, win 32120, length 0
02:42:50.091907 enp3s0 Out IP localhost.localdomain.56836 > ip-api.com.http: Flags [P.], seq 1:161, ack 1, win 32120, length 160: HTTP: GET /json/172.217.25.163 HTTP/1.1
02:42:50.106814 enp3s0 In  IP 216.239.34.223.http > localhost.localdomain.46496: Flags [.], ack 219, win 1050, options [nop,nop,TS val 1822188963 ecr 1433045913], length 0
02:42:50.106916 wlp2s0 Out IP 216.239.34.223.http > 10.0.0.100.46496: Flags [.], ack 219, win 1050, options [nop,nop,TS val 1822188963 ecr 1433045913], length 0
02:42:50.114743 enp3s0 Out IP localhost.localdomain.56872 > ip-api.com.http: Flags [S], seq 2338341982, win 32120, options [mss 1460,sackOK,TS val 1400307291 ecr 0,nop,wscale 7], length 0
02:42:50.144850 enp3s0 Out IP localhost.localdomain.56882 > ip-api.com.http: Flags [S], seq 2901788234, win 32120, options [mss 1460,sackOK,TS val 1400307321 ecr 0,nop,wscale 7], length 0
02:42:50.147315 enp3s0 Out IP localhost.localdomain.56884 > ip-api.com.http: Flags [S], seq 3745768486, win 32120, options [mss 1460,sackOK,TS val 1400307323 ecr 0,nop,wscale 7], length 0
02:42:50.160527 enp3s0 In  IP ip-api.com.http > localhost.localdomain.56864: Flags [S.], seq 2566522065, ack 1284972792, win 8190, options [mss 1460], length 0
02:42:50.160569 enp3s0 Out IP localhost.localdomain.56864 > ip-api.com.http: Flags [.], ack 1, win 32120, length 0
02:42:50.160628 enp3s0 Out IP localhost.localdomain.56864 > ip-api.com.http: Flags [P.], seq 1:161, ack 1, win 32120, length 160: HTTP: GET /json/216.239.34.223 HTTP/1.1
02:42:50.195625 enp3s0 In  IP ip-api.com.http > localhost.localdomain.56872: Flags [S.], seq 2465835438, ack 2338341983, win 8190, options [mss 1460], length 0
02:42:50.195651 enp3s0 Out IP localhost.localdomain.56872 > ip-api.com.http: Flags [.], ack 1, win 32120, length 0
02:42:50.195716 enp3s0 Out IP localhost.localdomain.56872 > ip-api.com.http: Flags [P.], seq 1:161, ack 1, win 32120, length 160: HTTP: GET /json/216.239.34.223 HTTP/1.1
02:42:50.233341 enp3s0 In  IP ip-api.com.http > localhost.localdomain.56882: Flags [S.], seq 899785182, ack 2901788235, win 8190, options [mss 1460], length 0
02:42:50.233405 enp3s0 Out IP localhost.localdomain.56882 > ip-api.com.http: Flags [.], ack 1, win 32120, length 0
02:42:50.233464 enp3s0 Out IP localhost.localdomain.56882 > ip-api.com.http: Flags [P.], seq 1:161, ack 1, win 32120, length 160: HTTP: GET /json/216.239.34.223 HTTP/1.1
02:42:50.234800 enp3s0 In  IP ip-api.com.http > localhost.localdomain.56884: Flags [S.], seq 164443975, ack 3745768487, win 8190, options [mss 1460], length 0
02:42:50.234809 enp3s0 Out IP localhost.localdomain.56884 > ip-api.com.http: Flags [.], ack 1, win 32120, length 0
02:42:50.234856 enp3s0 Out IP localhost.localdomain.56884 > ip-api.com.http: Flags [P.], seq 1:161, ack 1, win 32120, length 160: HTTP: GET /json/216.239.34.223 HTTP/1.1
02:42:50.354581 enp3s0 Out IP localhost.localdomain.56816 > ip-api.com.http: Flags [P.], seq 1:161, ack 1, win 32120, length 160: HTTP: GET /json/172.217.25.163 HTTP/1.1
02:42:50.378662 enp3s0 Out IP localhost.localdomain.56832 > ip-api.com.http: Flags [P.], seq 1:161, ack 1, win 32120, length 160: HTTP: GET /json/172.217.25.163 HTTP/1.1
02:42:50.418674 enp3s0 Out IP localhost.localdomain.56848 > ip-api.com.http: Flags [P.], seq 1:161, ack 1, win 32120, length 160: HTTP: GET /json/172.217.25.163 HTTP/1.1
02:42:50.426629 enp3s0 Out IP localhost.localdomain.56836 > ip-api.com.http: Flags [P.], seq 1:161, ack 1, win 32120, length 160: HTTP: GET /json/172.217.25.163 HTTP/1.1
02:42:50.490543 enp3s0 Out IP localhost.localdomain.56864 > ip-api.com.http: Flags [P.], seq 1:161, ack 1, win 32120, length 160: HTTP: GET /json/216.239.34.223 HTTP/1.1
02:42:50.530577 enp3s0 Out IP localhost.localdomain.56872 > ip-api.com.http: Flags [P.], seq 1:161, ack 1, win 32120, length 160: HTTP: GET /json/216.239.34.223 HTTP/1.1
02:42:50.562655 enp3s0 Out IP localhost.localdomain.56884 > ip-api.com.http: Flags [P.], seq 1:161, ack 1, win 32120, length 160: HTTP: GET /json/216.239.34.223 HTTP/1.1
02:42:50.562658 enp3s0 Out IP localhost.localdomain.56882 > ip-api.com.http: Flags [P.], seq 1:161, ack 1, win 32120, length 160: HTTP: GET /json/216.239.34.223 HTTP/1.1
02:42:50.766463 enp3s0 Out IP localhost.localdomain.56890 > ip-api.com.http: Flags [S], seq 3470150481, win 32120, options [mss 1460,sackOK,TS val 1400307942 ecr 0,nop,wscale 7], length 0
02:42:50.768779 enp3s0 Out IP localhost.localdomain.56892 > ip-api.com.http: Flags [S], seq 3598778574, win 32120, options [mss 1460,sackOK,TS val 1400307945 ecr 0,nop,wscale 7], length 0
02:42:50.770633 enp3s0 Out IP localhost.localdomain.47066 > ip-api.com.http: Flags [P.], seq 1718952843:1718953003, ack 1902780215, win 32120, length 160: HTTP: GET /json/142.250.76.132 HTTP/1.1
02:42:50.855042 enp3s0 In  IP ip-api.com.http > localhost.localdomain.56890: Flags [S.], seq 1068950803, ack 3470150482, win 8190, options [mss 1460], length 0
02:42:50.855100 enp3s0 Out IP localhost.localdomain.56890 > ip-api.com.http: Flags [.], ack 1, win 32120, length 0
02:42:50.855180 enp3s0 Out IP localhost.localdomain.56890 > ip-api.com.http: Flags [P.], seq 1:161, ack 1, win 32120, length 160: HTTP: GET /json/142.250.76.132 HTTP/1.1
02:42:50.858733 enp3s0 In  IP ip-api.com.http > localhost.localdomain.56892: Flags [S.], seq 64690809, ack 3598778575, win 8190, options [mss 1460], length 0
02:42:50.858772 enp3s0 Out IP localhost.localdomain.56892 > ip-api.com.http: Flags [.], ack 1, win 32120, length 0
02:42:50.858839 enp3s0 Out IP localhost.localdomain.56892 > ip-api.com.http: Flags [P.], seq 1:161, ack 1, win 32120, length 160: HTTP: GET /json/172.217.25.163 HTTP/1.1
02:42:50.898658 enp3s0 Out IP localhost.localdomain.56796 > ip-api.com.http: Flags [P.], seq 1:161, ack 1, win 32120, length 160: HTTP: GET /json/142.250.76.132 HTTP/1.1
02:42:50.898672 enp3s0 Out IP localhost.localdomain.56778 > ip-api.com.http: Flags [P.], seq 1:161, ack 1, win 32120, length 160: HTTP: GET /json/172.217.25.163 HTTP/1.1
02:42:50.962606 enp3s0 Out IP localhost.localdomain.56802 > ip-api.com.http: Flags [P.], seq 1:161, ack 1, win 32120, length 160: HTTP: GET /json/142.250.76.132 HTTP/1.1
02:42:51.026543 enp3s0 Out IP localhost.localdomain.56810 > ip-api.com.http: Flags [P.], seq 1:161, ack 1, win 32120, length 160: HTTP: GET /json/142.250.76.132 HTTP/1.1
02:42:51.026571 enp3s0 Out IP localhost.localdomain.56816 > ip-api.com.http: Flags [P.], seq 1:161, ack 1, win 32120, length 160: HTTP: GET /json/172.217.25.163 HTTP/1.1
02:42:51.026576 enp3s0 Out IP localhost.localdomain.56808 > ip-api.com.http: Flags [P.], seq 1:161, ack 1, win 32120, length 160: HTTP: GET /json/216.239.34.223 HTTP/1.1
02:42:51.026579 enp3s0 Out IP localhost.localdomain.56812 > ip-api.com.http: Flags [P.], seq 1:161, ack 1, win 32120, length 160: HTTP: GET /json/142.250.76.132 HTTP/1.1
02:42:51.090582 enp3s0 Out IP localhost.localdomain.56848 > ip-api.com.http: Flags [P.], seq 1:161, ack 1, win 32120, length 160: HTTP: GET /json/172.217.25.163 HTTP/1.1
02:42:51.090598 enp3s0 Out IP localhost.localdomain.56832 > ip-api.com.http: Flags [P.], seq 1:161, ack 1, win 32120, length 160: HTTP: GET /json/172.217.25.163 HTTP/1.1
02:42:51.090615 enp3s0 Out IP localhost.localdomain.56836 > ip-api.com.http: Flags [P.], seq 1:161, ack 1, win 32120, length 160: HTTP: GET /json/172.217.25.163 HTTP/1.1
02:42:51.154580 enp3s0 Out IP localhost.localdomain.56864 > ip-api.com.http: Flags [P.], seq 1:161, ack 1, win 32120, length 160: HTTP: GET /json/216.239.34.223 HTTP/1.1
